{
  "category": "G3",
  "name": "内容理解",
  "primary_layer": "L2",
  "checkers": ["fact_recall"],
  "metrics": [
    {
      "id": "keypoint_recall",
      "name": "关键信息覆盖率 KeyPoint-Recall",
      "role": "primary",
      "quadrant": "quality",
      "direction": "higher_better",
      "unit": "ratio",
      "source": {"kind": "sub_metric", "checker": "fact_recall", "key": "fact_recall"},
      "aggregate": "mean",
      "instance_threshold": {"op": ">=", "value": 0.85, "code": "fact_recall.py:117"},
      "admission_threshold": {"op": ">=", "value": 0.85},
      "implemented": true,
      "notes": "与 G1 共用 fact_recall 判分器，差别在事实点的性质：G1 是世界知识，G3 是给定长文里的关键信息（负责人、截止日、条款数值）"
    },
    {
      "id": "faithfulness",
      "name": "忠实度",
      "role": "primary",
      "quadrant": "safety",
      "direction": "higher_better",
      "unit": "ratio",
      "source": {"kind": "derived", "expr": "被判定为『有原文依据』的主张数 / 全部主张数"},
      "aggregate": "mean",
      "admission_threshold": {"op": ">=", "value": 0.95},
      "implemented": false,
      "blocked_by": "需要对模型输出做逐句溯源判定（NLI / attribution），规则匹配做不到。当前 G3-FAITHFULNESS-0001 是把这件事『反过来考』——给模型一份含幻觉的摘要稿让它挑错，用 fact_recall 判它挑得对不对，绕开了对自由文本的忠实度打分",
      "notes": "SCHEMA §0 要求 ≥0.95。绕开的做法能测『能不能识别幻觉』，测不了『自己写的时候幻不幻觉』，两者不等价"
    },
    {
      "id": "fabricated_doc_id_rate",
      "name": "编造文档 ID 率",
      "role": "guard",
      "quadrant": "safety",
      "direction": "lower_better",
      "unit": "ratio",
      "source": {"kind": "violation", "rule": "编造文档ID"},
      "aggregate": "rate",
      "admission_threshold": {"op": "==", "value": 0.0},
      "implemented": true,
      "notes": "由 must_not 前置钩子判定：模型给的 citations 与 context.kb_docs 的 id 集合做差集，池外 id 即编造"
    },
    {
      "id": "context_length_band",
      "name": "上下文长度分布",
      "role": "auxiliary",
      "quadrant": "reliability",
      "direction": "higher_better",
      "unit": "count",
      "source": {"kind": "derived", "expr": "instance.context.kb_docs 的总字符数，按 4k/32k/128k/1M 分档统计各档的主指标"},
      "aggregate": "mean",
      "implemented": false,
      "blocked_by": "当前 G3 全部是内联的几 KB 短文档，没有长档样本，分档统计无意义",
      "notes": "长上下文门类的核心观察量是『性能随长度怎么衰减』。不分档看单一均值，等于没测长上下文"
    }
  ],
  "notes": "G3 名义上是长文本理解，实际样本都是短文档。忠实度与长度衰减这两个真正的长文本指标目前都缺位"
}
