{
  "category": "G5",
  "name": "方案设计",
  "primary_layer": "L3",
  "checkers": [
    "rubric_judge"
  ],
  "metrics": [
    {
      "id": "rubric_mean_5",
      "name": "Rubric 均分（5 分制）",
      "role": "primary",
      "quadrant": "quality",
      "direction": "higher_better",
      "unit": "score_5",
      "source": {
        "kind": "sub_metric",
        "checker": "rubric_judge",
        "key": "rubric_mean_5"
      },
      "aggregate": "mean",
      "instance_threshold": {
        "op": ">=",
        "value": 4.0,
        "code": "rubric_judge.py:122"
      },
      "admission_threshold": {
        "op": ">=",
        "value": 3.8
      },
      "implemented": true,
      "notes": "⚠️ 单条阈值（4.0，硬编码）与 SCHEMA §0 的门类准入线（3.8）不一致。两者含义不同：前者是单条 passed 的判定，后者是门类均分的准入线。aggregate.py 必须分别处理，不得混用。2026-09-21 起置为 implemented=true：此前的 blocked_by（env['judge'] 未接真实 LLM）在接入 Vertex judge 后已失效，judge_stub_ratio 实测 0.000，但标志位忘了同步改，导致 rubric 分虽已落在 sub_metrics 里却被报表整条跳过、完全不参与准入"
    },
    {
      "id": "risk_coverage",
      "name": "风险要素覆盖率",
      "role": "primary",
      "quadrant": "quality",
      "direction": "higher_better",
      "unit": "ratio",
      "source": {
        "kind": "sub_metric",
        "checker": "rubric_judge",
        "key": "must_cover_coverage"
      },
      "aggregate": "mean",
      "admission_threshold": {
        "op": ">=",
        "value": 0.8
      },
      "implemented": true,
      "notes": "复用 must_cover 覆盖率作为 SCHEMA §0 的「风险要素覆盖 ≥0.8」。实例的 gold.value.must_cover 里放的就是必须点到的风险项。⚠️ 实现是 rubric_judge.py:82 的裸子串匹配（normalize 后 `in`），并没有同义匹配——此前 notes 写的「字面/同义匹配」不属实。已知假阴性：2026-09-21 的跑批里 7 处判为漏掉的要点在原文中均有同义写法（回滚→回退/降级、切流→割接、停止准则→熔断/提前终止、数据一致性校验→一致性/比对），直接把 A/B 两侧都压到 0.8 以下。修好之前这一项的 FAIL 不能当作能力结论"
    },
    {
      "id": "per_dim_score",
      "name": "各维度分（按 rubric 维度展开）",
      "role": "auxiliary",
      "quadrant": "quality",
      "direction": "higher_better",
      "unit": "score_5",
      "source": {
        "kind": "sub_metric",
        "checker": "rubric_judge",
        "key": "per_dim"
      },
      "aggregate": "mean",
      "implemented": false,
      "blocked_by": "同 rubric_mean_5；且 per_dim 是 dict，aggregate 需按维度名分组求均值",
      "notes": "维度来自实例的 gold.value.dims。展开后能看出模型是「结构差」还是「完整性差」"
    },
    {
      "id": "judge_stub_ratio",
      "name": "Judge 桩占比",
      "role": "guard",
      "quadrant": "reliability",
      "direction": "lower_better",
      "unit": "ratio",
      "source": {
        "kind": "sub_metric",
        "checker": "rubric_judge",
        "key": "stub"
      },
      "aggregate": "mean",
      "admission_threshold": {
        "op": "==",
        "value": 0.0
      },
      "implemented": true,
      "notes": "报表可信度守卫。只要 >0 就说明这批 rubric 分是启发式桩打的，rubric_mean_5 一律不得用于准入决策。不带 --judge 跑、或 judge 不可用时为 1.0；2026-09-21 接入 Vertex judge 后实测 0.000"
    }
  ],
  "notes": "G5 整体卡在 judge 上。唯一可信的是 risk_coverage。在真实 judge 接通并完成 κ≥0.7 校准之前，G5 不具备准入判定能力"
}
